{
  "id": "coding",
  "uses_features": true,
  "architecture_on_close": true,
  "checks": null,
  "nodes": [
    {
      "id": "work",
      "priors": [],
      "entry": [],
      "complete": [],
      "workers": []
    },
    {
      "id": "closed",
      "priors": ["work"],
      "entry": [
        {"predicate": "exists", "glob": "design.md", "root": "session"},
        {"predicate": "exists", "glob": "review.md", "root": "session"},
        {"predicate": "exists", "glob": "verify.md", "root": "session"}
      ],
      "complete": [
        {"predicate": "exists", "glob": "design.md", "root": "session"},
        {"predicate": "exists", "glob": "review.md", "root": "session"},
        {"predicate": "exists", "glob": "verify.md", "root": "session"}
      ],
      "workers": []
    }
  ]
}
